<?xml version="1.0" encoding="UTF-8"?>
<log xmlns:xsi="http://www.w3.org/2001/XMLSchema-instance" xsi:noNamespaceSchemaLocation="log.xsd">
	<item id="1">
		<nome>Inserita immagine</nome>
		<utente>defra91</utente>
		<timestamp>
			<data>
				<giorno>13</giorno>
				<mese>Marzo</mese>
				<anno>2014</anno>
			</data>
			<time>21:00:13</time>
		</timestamp>
	</item>

	<item id="2">
		<nome>Cancellato evento</nome>
		<utente>defra91</utente>
		<timestamp>
			<data>
				<giorno>20</giorno>
				<mese>Marzo</mese>
				<anno>2014</anno>
			</data>
			<time>16:14:21</time>
		</timestamp>
	</item>
</log>